{
  "timestamp": "2025-11-23T22:26:10.130198",
  "target": "127.0.0.1",
  "status": "stealth_vein_complete",
  "stealth_ping": "hit",
  "open_ports": [
    "135/tcp  open     msrpc         Microsoft Windows RPC",
    "445/tcp  open     microsoft-ds?",
    "5357/tcp open     http          Microsoft HTTPAPI httpd 2.0 (SSDP/UPnP)"
  ],
  "parsed_ports": {
    "135": {
      "service": "msrpc",
      "version": "Microsoft Windows RPC"
    },
    "445": {
      "service": "microsoft-ds?",
      "version": "unknown"
    },
    "5357": {
      "service": "http",
      "version": "Microsoft HTTPAPI httpd 2.0 (SSDP/UPnP)"
    }
  },
  "vuln_seeds": [
    "5357"
  ],
  "full_output": "Starting Nmap 7.98 ( https://nmap.org ) at 2025-11-23 22:25 -0700\nNmap scan report for localhost (127.0.0.1)\nHost is up (0.000091s latency).\nNot shown: 96 closed tcp ports (reset)\nPORT     STATE    SERVICE       VERSION\n53/tcp   filtered domain\n135/tcp  open     msrpc         Microsoft Windows RPC\n445/tcp  open     microsoft-ds?\n5357/tcp open     http          Microsoft HTTPAPI httpd 2.0 (SSDP/UPnP)\nService Info: OS: Windows; CPE: cpe:/o:microsoft:windows\n\nService detection performed. Please report any incorrect results at https://nmap.org/submit/ .\nNmap done: 1 IP address (1 host up) scanned in 12.54 seconds\n"
}